<?xml version="1.0" encoding="UTF-8"?>
<!DOCTYPE datospersonales SYSTEM 'FormularioContrato.dtd'>
<datospersonales xmlns:xsi="http://www.w3.org/2001/XMLSchema-instance"
    xsi:noNamespaceSchemaLocation="FormularioContrato.xsd">
    <nombre>diego</nombre>
    <apellido>casta√±o</apellido>
    <gmail>diego@gmail.com</gmail>
    <contrasenya>paso1234*</contrasenya>
    <DNI>71047190Y</DNI>
    <telefono>607648706</telefono>
    <localidad>Benavente</localidad>
    <provincia></provincia>
    <fech_nac>2002-01-27</fech_nac>
    <direccion>Avenida Luis Moran</direccion>
    <CP>11111</CP>
    <estudios>
        <si>si</si>
        <no>no</no>
    </estudios>
    <hamburguesa>
        <pollo tipo="uno">frito</pollo>
        <ternera tipo="dos">hecha</ternera>
    </hamburguesa>
    <hora>8</hora>
    <observaciones>todo fue bien</observaciones>
</datospersonales>